product_name,number_of_reviews,price
"DUNLOP Men's Modern 100% Waterproof PVC, Lightweight and Durable, 8677577.07, Black, 7",N/A,$31.18
Chef Works Women's Hartford Cool Vent Chef Coat,N/A,$38.24
PRETTYGARDEN Women's Summer One Shoulder Long Formal Dresses Sleeveless Ruched Bodycon Wedding Guest Slit Maxi Dress,N/A,$65.99
MEROKEETY Women's Sleeveless Lace Floral Elegant Cocktail Dress Crew Neck Knee Length for Party,N/A,$53.99
"72styles Infinity Dress with Bandeau, Convertible Bridesmaid Dress, Long, Plus Size, Multi-Way Dress, Twist Wrap Dress",N/A,N/A
"Crocs Women’s Brooklyn Low Wedges, Platform Sandals",N/A,N/A
Urban CoCo Women's Basic Versatile Stretchy Flared Casual Mini Skater Skirt,N/A,$16.75
Amazon Essentials Women's Two Strap Heeled Sandal,N/A,$28.50
MEROKEETY Women's V Neck Short Sleeve Floral Lace Wedding Dress Bridesmaid Cocktail Party Maxi Dress,N/A,$59.99
"REEF Water Vista Womens Platform Sandal, Water Friendly, Adjustable Velcro Strap",N/A,$60.00
SUUKSESS Women Sexy Mesh Tummy Control Swimsuit Push Up High Waisted Bathing Suit,N/A,$33.99
Steve Madden womens Hadyn,N/A,$59.00
"REEF Cushion Vista Women's Fashion Slide Sandal, Vegan Leather Strap, Ultra Soft Cushion Footbed",N/A,N/A
Clarks Womens Breeze Sea,N/A,$30.37
CUSHIONAIRE Women's Luna Cork Footbed Sandal With +Comfort,N/A,N/A
MEROKEETY Women's V Neck Wrap Velvet Maxi Dress Bell Sleeve Split Bridesmaid Cocktail Party Dresses,N/A,$57.99
Wrangler Women's Ladies Rayon Horseshoe Boot Socks 3 Pair Pack,N/A,$19.99
Lee Women's Ultra Lux Comfort with Flex Motion Trouser Pant,N/A,$31.90
Michael Kors Gold-Tone Hoop Earrings for Women; Huggie Earrings for Women; Stainless Steel Earrings; Jewelry for Women,N/A,$89.82
Nomad Women's Pursuit Long Sleeve Hunting Shirt W/Sun Protection,N/A,$34.85
KEEN Women's Elle Backstrap Casual Platform Open Toe Wedge Sandal,N/A,$57.00
Dr. Martens Women's Slide Sandal,N/A,$72.70
"Crocs Women's Brooklyn Buckle Low Wedge, Platform Sandals",N/A,N/A
MEROKEETY Women 2024 Summer Strapless Satin Tube Bodycon Backless Wedding Guest Maxi Dress,N/A,$51.99
MEROKEETY Women's Flutter Short Sleeve Smocked Midi Dress Summer Casual Tiered A-Line Dress,N/A,$48.99
"Crocs Women's Swiftwater Sandal, Lightweight and Sporty Sandals for Women",N/A,N/A
Blooming Jelly Womens Casual Sun Summer Dresses Swiss Polka Dot Beach Cover Up V Neck Tank Dress with Pockets,N/A,$29.99
Dokotoo Womens Summer Dresses Square Neck Tie Back Lantern Sleeve Ruffle A-Line Casual Dress,N/A,$39.99
Soda Topic Open Toe Buckle Ankle Strap Espadrilles Flatform Wedge Casual Sandal,N/A,N/A
Birkenstock Men's Amalfi Leather Soft Footbed Arizona Sandals,N/A,N/A
Skechers Womens Flex Appeal 2.0 Start Up,N/A,$40.19
MEROKEETY Women's Summer One Shoulder Sleeveless Knot Smocked Midi Dress Split Tiered Flowy Dresses,N/A,$48.99
Nomad Men's Pursuit Long Sleeve Hunting Shirt W/Sun Protection,N/A,$40.95
Nomad Men's Pursuit Short Sleeve Hunting Shirt W/Sun Protection,N/A,$34.03
Nomad Men's Pursuit Long Sleeve Hunting Shirt W/Sun Protection,N/A,$36.14
Nomad Men's Conifer Nxt Jacket | Water and Windproof Hunting Coat,N/A,$184.06
MEROKEETY Women's 2024 Summer Puff Sleeve Smocked Floral Dress Crewneck Lace Flowy Tiered Midi Dresses,N/A,$47.99
Birkenstock Unisex Arizona BS Birko-Flor Sandals,N/A,N/A
Amazon Essentials Women's Classic-Fit Long-Sleeve Crewneck T-Shirt (Available in Plus Size),N/A,$17.10
Amoretu Women Summer Tunic Dress V Neck Casual Loose Flowy Swing Shift Dress,N/A,$44.83
GRACE KARIN Women's Gorgeous Pencil Dress Cap Sleeve Tweed Pencil Dress for Work,N/A,$47.99
Teva Unisex-Adult Kids Hurricane Drift Sandal,N/A,$44.95
GRACE KARIN Dress Women Pencil Dress Cap Sleeve Pencil Dress,N/A,$39.99
Naturalizer Women Brenta Strappy Platform Dress Sandal,N/A,$56.19
TOP Moda Darcie-1 Women's Fashion Ankle Strap Chunky Low Heel Dress Sandal Shoes,N/A,N/A
ecco womens Yucatan Sandal,N/A,$140.00
Skechers Women's On-the-go 600 - Brilliancy Sport Sandal,N/A,N/A
Dr. Martens Women's Blaire Sandal,N/A,$82.50
Soda ACCOUNT ~ Women Open Toe Two Bands Lug sole Fashion Block Heel Sandals with Adjustable Ankle Strap,N/A,N/A
Naturalizer Women Baylor Strappy High Heel,N/A,$47.98
Crocs Women's Classic Slide | Platform Sandals,N/A,N/A
"REEF Fanning Women's Bottle Opener Flip Flop, Arch Support, Durable Outsole, Water Friendly",N/A,$42.97
KEEN Women's Newport H2 Closed Toe Water Sandals.,N/A,N/A
Hanpceirs Women's Boatneck Sleeveless Swing Vintage 1950s Cocktail Dress New,N/A,$32.99
"REEF Cushion Breeze Women's Flip Flop, Ultra Soft Cushion Footbed, Arch Support",N/A,$30.62
Crocs Women's Kadee Ii Flip Flop Sandal,N/A,$19.44
Rainbow Sandals Women's Single Layer Leather Sandal Narrow Strap,N/A,N/A
Vince Camuto Women's Saprenda Heeled Sandal,N/A,$69.21
Lucky Brand Women's Low Rise Lolita Skinny Jean,N/A,$53.04
"Eskimo 39439 Women's Scout Ice Fishing Jacket, Frost",N/A,$164.40
