title,price,offer_percentage,sold,link
SKMEI Fashion Quartz Waterproof Creative Stainless Steel Business Watch For Men 1260 Black  Ghori Wala,৳ 495,51% Off,471 sold,https://www.daraz.com.bd/products/skmei-1260-i331079107.html
POEDAGAR Luxury Watch Business Waterproof Male Clock Luminous Date Stainless Steel Square Quartz Men Watch 613,৳ 999,45% Off,421 sold,https://www.daraz.com.bd/products/poedagar-613-i324338179.html
mens watch mens Digital smart watch boy smart watch beautiful design,৳ 120,60% Off,260 sold,https://www.daraz.com.bd/products/-i364891518.html
SKMEI 1787 Rotation Wheels Fashion Men Stainless Steel Watch For Man,৳ 799,48% Off,48 sold,https://www.daraz.com.bd/products/skmei-1787-i332885885.html
POEDAGAR Men Watch Top Brand Luxury Business Quartz Mens Watches Full Steel Waterproof Luminous Wristwatch Men Relogio Masculino,৳ 630,50% Off,275 sold,https://www.daraz.com.bd/products/poedagar-men-watch-top-brand-luxury-business-quartz-mens-watches-full-steel-waterproof-luminous-wristwatch-men-relogio-masculino-i323674712.html
(Ready Stock) Original G-Shock Men Sport Digital Classic Square Watch Shockproof and Waterproof Stainless Steel Band Sports Business Wrist Watches with 2 Year International Warranty F91W,৳ 699,52% Off,72 sold,https://www.daraz.com.bd/products/2-f91w-i367799394.html
SKMEI 1787 Fashion Creative Cool Black Watch Cutout Concept Dial Metal Style Waterproof Sports Watch For Men,৳ 849,59% Off,119 sold,https://www.daraz.com.bd/products/skmei-1787-fashion-creative-cool-black-watch-cutout-concept-dial-metal-style-waterproof-sports-watch-for-men-i317666629.html
SANDA Couple Watch 30M Waterproof Casual Fashion Women Men Quartz Watches Wear Resistant Leather Strap Square Dial Design Reloj,"৳ 1,696",50% Off,628 sold,https://www.daraz.com.bd/products/sanda-30m-i402590631.html
Top Luxury Brand Couple Watch For Women Men Clock Male Calendar Love Dial Quartz Wrist Watches Leather Ladies Man Watch,৳ 512,71% Off,1.2K sold,https://www.daraz.com.bd/products/-i400999507.html
6PCS Set Women Love Dial Watch Brand Design Female Clock Pink Leather Band Ladies Watches Simple Casual Quartz Wristwatches,৳ 946,50% Off,740 sold,https://www.daraz.com.bd/products/shaarms-6pcs-i401565347.html
Olevs Luxury Fashion Stainless Steel Unique Design Diamond Cutting Glass Wrist-Watche For Men,৳ 599,56% Off,1.0K sold,https://www.daraz.com.bd/products/olevs-luxury-fashion-stainless-steel-unique-design-diamond-cutting-glass-wrist-watche-for-men-i328851942.html
Luxury 9931 Trendy Korean Style Luminous Calendar With Individual Gift Box Couple Watch,"৳ 1,140",55% Off,78 sold,https://www.daraz.com.bd/products/luxury-9931-trendy-korean-style-luminous-calendar-with-individual-gift-box-couple-watch-i350758296.html
Digital Watch Fashion Watch for Mens Sports Waterproof Simple Silicone Electronic Watch - Men Seeking Fashion and Style,৳ 94,73% Off,1.2K sold,https://www.daraz.com.bd/products/digital-watch-fashion-watch-for-mens-sports-waterproof-simple-silicone-electronic-watch-men-seeking-fashion-and-style-i288560053.html
TRSOYE luxury leather belt fashion quartz wrist-watche for men,৳ 299,78% Off,132 sold,https://www.daraz.com.bd/products/trsoye-luxury-leather-belt-fashion-quartz-wrist-watche-for-men-i362635717.html
Stylish OLIVS Stainless Steel Lather Band Fashionable Man Watch,৳ 387,48% Off,66 sold,https://www.daraz.com.bd/products/olivs-i318941048.html
FORSINING 8202 luxury Automatic Mechanical Watch,"৳ 3,598",47% Off,224 sold,https://www.daraz.com.bd/products/forsining-8202-i264523031.html
SKMEI 1505 Men Digital Sport Watches Rectangle Gold Wristwatch for Male LED Stopwatch Touch Watch For men,৳ 399,80% Off,28 sold,https://www.daraz.com.bd/products/skmei-1505-led-i322911535.html
Leather Analog Wrist Watch For Men - Black And white,৳ 158,67% Off,68 sold,https://www.daraz.com.bd/products/-i101844633.html
New Fashionable stainless analogue Hand watches for men's - Watch,৳ 129,72% Off,107 sold,https://www.daraz.com.bd/products/new-fashionable-stainless-analogue-hand-watches-for-mens-watch-i266494990.html
Digital Watch Waterproof Watch for Men's Sports Waterproof Simple Silicone Watch for men,৳ 195,68% Off,25 sold,https://www.daraz.com.bd/products/-i392038705.html
Current 8 Man leather analog watch for men,৳ 140,72% Off,50 sold,https://www.daraz.com.bd/products/8-i337003664.html
TRSOYE Men Fashion Watch Stainless Steel Quartz Watch - Watch For Men Remarkable - Disclose Styles & Luxe,৳ 620,65% Off,78 sold,https://www.daraz.com.bd/products/trsoye-men-fashion-watch-stainless-steel-quartz-watch-business-watch-for-men-remarkable-disclose-styles-luxe-i321979354.html
Black color Stylish waterproof watch for unisex,৳ 500,N/A,9 sold,https://www.daraz.com.bd/products/black-color-stylish-waterproof-watch-for-unisex-i391577357.html
OLEVS MEN'S WATCHES TOP BRAND LUXURY ORIGINAL WATERPROOF QUARTZ WATCH FOR MAN GOLD SKELETON STYLE 24 HOUR DAY NIGHT NEW,৳ 777,39% Off,143 sold,https://www.daraz.com.bd/products/olevs-24-i390511924.html
Digital Stop watch Timer,৳ 299,40% Off,341 sold,https://www.daraz.com.bd/products/-i306682797.html
NEW LASIKA W-F110 Digital Water Resistance/Waterproof Silicon Sports Digital Watch for Men - Watch For Men - Watch - ঘড়ি,৳ 255,36% Off,749 sold,https://www.daraz.com.bd/products/new-lasika-w-f110-digital-water-resistancewaterproof-silicon-sports-digital-watch-for-men-watch-for-men-watch-i213000062.html
LED Watch That For Everyone - Watches  wonder full watches,৳ 250,50% Off,16 sold,https://www.daraz.com.bd/products/led-i390047272.html
New Men's Business Luxury Watch Stainless Clock Steel Analog Quartz watch,৳ 270,46% Off,19 sold,https://www.daraz.com.bd/products/-i389448235.html
Paidu Wrist Watch for men,৳ 165,63% Off,293 sold,https://www.daraz.com.bd/products/paidu-wrist-watch-for-men-i228882226.html
Rosra Steeliness Steel Watch For Men\'s black matte,৳ 380,55% Off,9 sold,https://www.daraz.com.bd/products/rosra-steeliness-steel-watch-for-mens-black-matte-i394473511.html
OLI-VS 9931 Trendy Korean Style Luminous Calendar With Individual Gift Box Couple Watch,"৳ 1,140",55% Off,45 sold,https://www.daraz.com.bd/products/oli-vs-9931-trendy-korean-style-luminous-calendar-with-individual-gift-box-couple-watch-i350743941.html
TRSOYE new luxury fashion leather belt wrist-watche for men,৳ 434,70% Off,5 sold,https://www.daraz.com.bd/products/trsoye-new-luxury-fashion-leather-belt-wrist-watche-for-men-i389164994.html
New Men's Business Luxury Watch Stainless Clock Steel Analog Quartz watch,৳ 279,44% Off,8 sold,https://www.daraz.com.bd/products/-i389363658.html
premium quality Boy's Digital Waterproof Sport Fashion Luxury Military Quartz Watch Alarm Day Time LED Wristwatches With BOX,৳ 299,65% Off,N/A,https://www.daraz.com.bd/products/led-i264724716.html
New Men's Business Luxury Watch Stainless Clock Steel Analog Quartz watch,৳ 279,44% Off,6 sold,https://www.daraz.com.bd/products/-i389363556.html
NEW BINBOND With Box Top Brand Luxury Military Fashion Sport Watch Men Gold Wrist Watch Man Clock Casual Chronograph Wristwatch - Watch For Men - Watch,৳ 449,63% Off,7 sold,https://www.daraz.com.bd/products/new-binbond-with-box-top-brand-luxury-military-fashion-sport-watch-men-gold-wrist-watch-man-clock-casual-chronograph-wristwatch-watch-for-men-watch-i389186035.html
Apple Replica LED Digital Analog Silicon Belt Sports Watch for Men,৳ 295,55% Off,N/A,https://www.daraz.com.bd/products/apple-replica-led-digital-analog-silicon-belt-sports-watch-for-men-i394418096.html
POEDAGAR Top Brand Luxury Men Watch Waterproof Luminous Stainless Steel Watches Sport Quartz Clock Mens Date Business Wristwatch,"৳ 1,143",71% Off,91 sold,https://www.daraz.com.bd/products/poedagar-i402120421.html
New Men's Business Luxury Watch Stainless Clock Steel Analog Quartz watch,৳ 270,46% Off,5 sold,https://www.daraz.com.bd/products/-i389362443.html
SKMEI 9268 Luxurious Fashionable Top Brand Waterproof Stainless Steel Quartz Wristwatch For Men,৳ 665,62% Off,7 sold,https://www.daraz.com.bd/products/skmei-9268-luxurious-fashionable-top-brand-waterproof-stainless-steel-quartz-wristwatch-for-men-i389170934.html
